text,category,marks_range,order
"Setswana or any other Local language","Proficiency","0-10",1
"Level of Education, Training & Experience","Education & Experience","0-15",2
"Business Priority (Non Priority Sector, Priority Sector)","Business Priority","0-15",3
"Level of Investment 1. Initial Capital Injection, Minimum P250,000.00) 2. Current Level of Investment, Minimum P5 million.","Investment","0-40",4
"Level of Employment (Ten (10) Employees and Above)","Employment","0-15",5
"Corporate Social Responsibility","Corporate Social Responsibility","0-5",6